{
  "_comentario": "Respuesta correcta de cada pedido. cantidad_cajas siempre en cajas (convertidas con uds_por_caja y cajas_por_pale de tarifa.csv). precio_caja es el de la tarifa del cliente (columna precio_caja_<tarifa>); null si la referencia no existe. Las incidencias con obligatoria=true tienen que aparecer para dar el caso por bueno.",
  "empresa": "Conservas Marjal Blanca S.L.",
  "fecha_referencia": "2026-09-10",
  "pedidos": [
    {
      "id": "pedido-01",
      "fichero": "pedido-01.txt",
      "cliente": "Supermercados Serrano S.L.",
      "nif_cliente": "B34029173",
      "tarifa": "serrano",
      "formato": "correo en texto, con referencias",
      "lineas": [
        {
          "referencia": "CONS-ATUN-OL-120",
          "descripcion": "Atún claro en aceite de oliva · Lata RO-120 (120 g / 85 g esc.)",
          "cantidad_cajas": 40,
          "precio_caja": 24.29
        },
        {
          "referencia": "CONS-ATUN-NA-120",
          "descripcion": "Atún claro al natural · Lata RO-120 (120 g / 85 g esc.)",
          "cantidad_cajas": 25,
          "precio_caja": 21.64
        },
        {
          "referencia": "CONS-BONI-OL-220",
          "descripcion": "Bonito del norte en aceite de oliva · Lata RO-220 (220 g / 160 g esc.)",
          "cantidad_cajas": 15,
          "precio_caja": 34.22
        },
        {
          "referencia": "CONS-ALCA-CO-T370",
          "descripcion": "Corazones de alcachofa de la Vega Baja · Tarro cristal 370 ml (350 g / 200 g esc.)",
          "cantidad_cajas": 30,
          "precio_caja": 24.84
        },
        {
          "referencia": "CONS-TOMA-FR-T370",
          "descripcion": "Tomate frito con aceite de oliva · Tarro cristal 370 ml (350 g)",
          "cantidad_cajas": 20,
          "precio_caja": 14.9
        }
      ],
      "importe_lineas_eur": 3069.1,
      "incidencias": [],
      "nota": "Caso limpio: referencias explícitas, tarifa Serrano (–8 %)."
    },
    {
      "id": "pedido-02",
      "fichero": "pedido-02.txt",
      "cliente": "Distribuciones Hermanos Cascales S.L.",
      "nif_cliente": "B33911082",
      "tarifa": "cascales",
      "formato": "tabla pegada desde Excel (tabuladores), con precios",
      "lineas": [
        {
          "referencia": "CONS-ATUN-OL-120",
          "descripcion": "Atún claro en aceite de oliva · Lata RO-120 (120 g / 85 g esc.)",
          "cantidad_cajas": 60,
          "precio_caja": 23.23
        },
        {
          "referencia": "CONS-ATUN-GI-120",
          "descripcion": "Atún claro en aceite de girasol · Lata RO-120 (120 g / 85 g esc.)",
          "cantidad_cajas": 40,
          "precio_caja": 20.06
        },
        {
          "referencia": "CONS-SARD-OL-120",
          "descripcion": "Sardinillas en aceite de oliva · Lata RR-125 (125 g / 90 g esc.)",
          "cantidad_cajas": 20,
          "precio_caja": 26.61
        },
        {
          "referencia": "CONS-MEJI-ES-120",
          "descripcion": "Mejillones en escabeche 8/12 piezas · Lata RR-125 (115 g / 69 g esc.)",
          "cantidad_cajas": 15,
          "precio_caja": 29.99
        },
        {
          "referencia": "CONS-CALA-TI-120",
          "descripcion": "Calamares en su tinta · Lata RR-125 (115 g / 72 g esc.)",
          "cantidad_cajas": 10,
          "precio_caja": 25.13
        },
        {
          "referencia": "CONS-TOMA-TR-T720",
          "descripcion": "Tomate triturado · Tarro cristal 720 ml (700 g)",
          "cantidad_cajas": 50,
          "precio_caja": 8.71
        },
        {
          "referencia": "CONS-GARB-CO-T720",
          "descripcion": "Garbanzos cocidos · Tarro cristal 720 ml (660 g / 400 g esc.)",
          "cantidad_cajas": 30,
          "precio_caja": 8.18
        }
      ],
      "importe_lineas_eur": 4110.45,
      "incidencias": [],
      "nota": "Tabla con tabuladores; los precios que pone el cliente coinciden con su tarifa (–12 %)."
    },
    {
      "id": "pedido-03",
      "fichero": "pedido-03.txt",
      "cliente": "Grupo Hostelero Mediterráneo S.L.",
      "nif_cliente": "B37205416",
      "tarifa": "mediterraneo",
      "formato": "orden de compra en PDF (texto extraído, cabeceras y pies de página)",
      "lineas": [
        {
          "referencia": "CONS-ATUN-OL-1K",
          "descripcion": "Atún claro en aceite de oliva hostelería · Lata 1 kg (1000 g / 700 g esc.)",
          "cantidad_cajas": 24,
          "precio_caja": 45.03
        },
        {
          "referencia": "CONS-ALCA-CO-3K",
          "descripcion": "Corazones de alcachofa hostelería · Lata 3 kg (2.500 g / 1.500 g esc.)",
          "cantidad_cajas": 12,
          "precio_caja": 33.06
        },
        {
          "referencia": "CONS-PIQU-EN-3K",
          "descripcion": "Pimientos del piquillo enteros hostelería · Lata 3 kg (2.500 g / 1.800 g esc.)",
          "cantidad_cajas": 10,
          "precio_caja": 31.92
        },
        {
          "referencia": "CONS-TOMA-TR-3K",
          "descripcion": "Tomate triturado hostelería · Lata 3 kg",
          "cantidad_cajas": 30,
          "precio_caja": 13.68
        },
        {
          "referencia": "CONS-TOMA-FR-3K",
          "descripcion": "Tomate frito hostelería · Lata 3 kg",
          "cantidad_cajas": 16,
          "precio_caja": 16.72
        },
        {
          "referencia": "CONS-ANCH-OL-50",
          "descripcion": "Filetes de anchoa en aceite de oliva · Lata 50 g (29 g esc.)",
          "cantidad_cajas": 8,
          "precio_caja": 50.16
        }
      ],
      "importe_lineas_eur": 2875.84,
      "incidencias": [],
      "nota": "PDF con cabecera, pie y totales; formatos de hostelería (latas de 1 y 3 kg). Tarifa Mediterráneo (–5 %)."
    },
    {
      "id": "pedido-04",
      "fichero": "pedido-04.txt",
      "cliente": "Cash Vega Baja S.A.",
      "nif_cliente": "A32884553",
      "tarifa": "cash",
      "formato": "hoja de cálculo exportada a CSV (punto y coma)",
      "lineas": [
        {
          "referencia": "CONS-ATUN-OL-120",
          "descripcion": "Atún claro en aceite de oliva · Lata RO-120 (120 g / 85 g esc.)",
          "cantidad_cajas": 80,
          "precio_caja": 23.76
        },
        {
          "referencia": "CONS-ATUN-GI-120",
          "descripcion": "Atún claro en aceite de girasol · Lata RO-120 (120 g / 85 g esc.)",
          "cantidad_cajas": 60,
          "precio_caja": 20.52
        },
        {
          "referencia": "CONS-ATUN-NA-120",
          "descripcion": "Atún claro al natural · Lata RO-120 (120 g / 85 g esc.)",
          "cantidad_cajas": 40,
          "precio_caja": 21.17
        },
        {
          "referencia": "CONS-SARD-TO-120",
          "descripcion": "Sardinas en tomate · Lata RR-125 (125 g / 90 g esc.)",
          "cantidad_cajas": 30,
          "precio_caja": 17.93
        },
        {
          "referencia": "CONS-CABA-OL-120",
          "descripcion": "Caballa del sur en aceite de oliva · Lata RO-120 (120 g / 85 g esc.)",
          "cantidad_cajas": 30,
          "precio_caja": 19.44
        },
        {
          "referencia": "CONS-ALCA-CO-T370",
          "descripcion": "Corazones de alcachofa de la Vega Baja · Tarro cristal 370 ml (350 g / 200 g esc.)",
          "cantidad_cajas": 40,
          "precio_caja": 24.3
        },
        {
          "referencia": "CONS-PIQU-TI-T370",
          "descripcion": "Pimientos del piquillo en tiras · Tarro cristal 370 ml (350 g / 220 g esc.)",
          "cantidad_cajas": 24,
          "precio_caja": 20.52
        },
        {
          "referencia": "CONS-ACEI-VE-T370",
          "descripcion": "Aceitunas verdes manzanilla con hueso · Tarro cristal 370 ml (350 g / 200 g esc.)",
          "cantidad_cajas": 36,
          "precio_caja": 13.5
        }
      ],
      "importe_lineas_eur": 7050.38,
      "incidencias": [],
      "nota": "CSV con punto y coma y descripciones en mayúsculas sin acentos. Tarifa Cash (–10 %)."
    },
    {
      "id": "pedido-05",
      "fichero": "pedido-05.txt",
      "cliente": "Restaurante Casa Pepa (Josefa Belmonte Cano)",
      "nif_cliente": "21489302B",
      "tarifa": "general",
      "formato": "nota manuscrita escaneada con OCR sucio",
      "lineas": [
        {
          "referencia": "CONS-ATUN-OL-1K",
          "descripcion": "Atún claro en aceite de oliva hostelería · Lata 1 kg (1000 g / 700 g esc.)",
          "cantidad_cajas": 2,
          "precio_caja": 47.4
        },
        {
          "referencia": "CONS-ALCA-CO-3K",
          "descripcion": "Corazones de alcachofa hostelería · Lata 3 kg (2.500 g / 1.500 g esc.)",
          "cantidad_cajas": 4,
          "precio_caja": 34.8
        },
        {
          "referencia": "CONS-PIQU-EN-3K",
          "descripcion": "Pimientos del piquillo enteros hostelería · Lata 3 kg (2.500 g / 1.800 g esc.)",
          "cantidad_cajas": 1,
          "precio_caja": 33.6
        },
        {
          "referencia": "CONS-TOMA-FR-3K",
          "descripcion": "Tomate frito hostelería · Lata 3 kg",
          "cantidad_cajas": 3,
          "precio_caja": 17.6
        }
      ],
      "importe_lineas_eur": 320.4,
      "incidencias": [],
      "nota": "OCR con ceros por oes y eles por unos: «C0NS-ATUN-0L-1K», «l caja». La referencia se debe normalizar."
    },
    {
      "id": "pedido-06",
      "fichero": "pedido-06.txt",
      "cliente": "Bar-Cafetería El Racó de Toni (Antoni Buigues Soler)",
      "nif_cliente": "53210077Z",
      "tarifa": "general",
      "formato": "correo en valenciano, sin referencias (solo descripciones)",
      "lineas": [
        {
          "referencia": "CONS-ATUN-OL-120",
          "descripcion": "Atún claro en aceite de oliva · Lata RO-120 (120 g / 85 g esc.)",
          "cantidad_cajas": 2,
          "precio_caja": 26.4
        },
        {
          "referencia": "CONS-BONI-OL-220",
          "descripcion": "Bonito del norte en aceite de oliva · Lata RO-220 (220 g / 160 g esc.)",
          "cantidad_cajas": 1,